Date,Team,Player,Notes,DL_length,Injury_Type,player_id,pitcher
2018-04-09, Red Sox,Xander Bogaerts, placed on 10 day DL with fractured left ankle,10, fractured left ankle,593428.0,0
2018-04-09, Reds,Eugenio Suarez, placed on 10 day DL with fractured right thumb,10, fractured right thumb,553993.0,0
2018-04-09, Reds,Scott Schebler, placed on 10 day DL with bruised ulnar nerve in right elbow,10, bruised ulnar nerve in right elbow,594988.0,0
2018-04-10, Rangers,Rougned Odor, placed on 10 day DL with strained left hamstring,10, strained left hamstring,596059.0,0
2018-04-11, Mets,Travis d'Arnaud, placed on 10 day DL with torn UCL in right elbow,10, torn UCL in right elbow,518595.0,0
2018-04-11, Padres,Manuel Margot, placed on 10 day DL with bruised ribs,10, bruised ribs,622534.0,0
2018-04-13, Rangers,Elvis Andrus, placed on 10 day DL with fractured right elbow,10, fractured right elbow,462101.0,0
2018-04-16, Rays,Kevin Kiermaier, placed on 10 day DL with torn ligament in right thumb,10, torn ligament in right thumb,595281.0,0
2018-04-17, Nationals,Brian Goodwin, placed on 10 day DL with bruised left wrist,10, bruised left wrist,571718.0,0
2018-04-18, Twins,Byron Buxton, placed on 10 day DL with migraine headache,10, migraine headache,621439.0,0
2018-04-20, Giants,Hunter Pence, placed on 10 day DL with sprained right thumb,10, sprained right thumb,452254.0,0
2018-04-21, Padres,Hunter Renfroe, placed on 10 day DL with right elbow inflammation,10, right elbow inflammation,592669.0,0
2018-04-22, Nationals,Anthony Rendon, placed on 10 day DL with bruised left toe,10, bruised left toe,543685.0,0
2018-04-24, White Sox,Avisail Garcia, placed on 10 day DL with strained right hamstring,10, strained right hamstring,541645.0,0
2018-04-25, Brewers,Eric Thames, placed on 10 day DL with torn UCL in left thumb,10, torn UCL in left thumb,519346.0,0
2018-04-25, Orioles,Tim Beckham, placed on 10 day DL with strained left groin,10, strained left groin,542921.0,0
2018-04-25, Rangers,Adrian Beltre, placed on 10 day DL with strained left hamstring,10, strained left hamstring,134181.0,0
2018-04-28, Giants,Joe Panik, placed on 10 day DL with sprained left thumb,10, sprained left thumb,605412.0,0
2018-04-29, Dodgers,Yasiel Puig, placed on 10 day DL with left hip pointer,10, left hip pointer,624577.0,0
2018-04-29, Phillies,J.P. Crawford, placed on 10 day DL with strained right elbow/forearm,10, strained right elbow/forearm,641487.0,0
2018-04-30, Dodgers,Corey Seager, placed on 10 day DL with sprained UCL in right elbow,10, sprained UCL in right elbow,608369.0,0
2018-04-30, Rockies,D.J. LeMahieu, placed on 10 day DL with strained right hamstring,10, strained right hamstring,518934.0,0
2018-05-01, Twins,Miguel Sano, placed on 10 day DL with strained left hamstring,10, strained left hamstring,593934.0,0
2018-05-03, Blue Jays,Steve Pearce, placed on 10 day DL with strained left oblique muscle,10, strained left oblique muscle,456665.0,0
2018-05-04, Braves,Dansby Swanson, placed on 10 day DL with left wrist inflammation,10, left wrist inflammation,621020.0,0
2018-05-05, Twins,Jason Castro, placed on 10 day DL with torn meniscus in right knee,10, torn meniscus in right knee,488771.0,0
2018-05-05, White Sox,Yoan Moncada, placed on 10 day DL with tightness in left hamstring,10, tightness in left hamstring,660162.0,0
2018-05-08, Blue Jays,Aledmys Diaz, placed on 10 day DL with sprained left ankle,10, sprained left ankle,649557.0,0
2018-05-08, Cubs,Jason Heyward, placed on 7 day DL with concussion,7, concussion,518792.0,0
2018-05-09, Brewers,Nick Franklin, placed on 10 day DL with strained right quadriceps,10, strained right quadriceps,545338.0,0
2018-05-11, Nationals,Matt Wieters, placed on 10 day DL with strained left hamstring,10, strained left hamstring,446308.0,0
2018-05-12, Indians,Tyler Naquin, placed on 10 day DL with strained left hamstring,10, strained left hamstring,571980.0,0
2018-05-14, Giants,Alen Hanson, placed on 10 day DL with strained left hamstring,10, strained left hamstring,593700.0,0
2018-05-14, Mariners,Robinson Cano, placed on 10 day DL with fractured right hand,10, fractured right hand,429664.0,0
2018-05-14, Rockies,D.J. LeMahieu, placed on 10 day DL with sprained left thumb,10, sprained left thumb,518934.0,0
2018-05-14, Royals,Lucas Duda, placed on 10 day DL with plantar fasciitis in right foot,10, plantar fasciitis in right foot,446263.0,0
2018-05-14, Tigers,Jeimer Candelario, placed on 10 day DL with left wrist tendinitis,10, left wrist tendinitis,600869.0,0
2018-05-15, Diamondbacks,A.J. Pollock, placed on 10 day DL with fractured left thumb,10, fractured left thumb,572041.0,0
2018-05-15, Indians,Bradley Zimmer, placed on 10 day DL with bruised left rib,10, bruised left rib,605548.0,0
2018-05-15, Rangers,Adrian Beltre, placed on 10 day DL with strained left hamstring,10, strained left hamstring,134181.0,0
2018-05-16, Mets,Yoenis Cespedes, placed on 10 day DL with strained right hip flexor,10, strained right hip flexor,493316.0,0
2018-05-17, Athletics,Bruce Maxwell, placed on restricted list,0,unknown,622194.0,0
2018-05-18, Cardinals,Paul DeJong, placed on 10 day DL with fractured left hand,10, fractured left hand,657557.0,0
2018-05-18, Mets,Juan Lagares, placed on 10 day DL with surgery on left toe to repair torn plantar plate (out for season),10, surgery on left toe to repair torn plantar plate (out for season),501571.0,0
2018-05-18, Pirates,Starling Marte, placed on 10 day DL with strained right oblique muscle,10, strained right oblique muscle,516782.0,0
2018-05-19, Nationals,Howie Kendrick, placed on 10 day DL with torn right Achilles tendon,10, torn right Achilles tendon,435062.0,0
2018-05-19, Rays,Adeiny Hechavarria, placed on 10 day DL with strained right hamstring,10, strained right hamstring,588751.0,0
2018-05-19, Royals,Cheslor Cuthbert, placed on 10 day DL with strained lower back,10, strained lower back,596144.0,0
2018-05-19, Twins,Joe Mauer," placed on 10 day DL with cervical strain, concussion",10," cervical strain, concussion",408045.0,0
2018-05-19, White Sox,Nicky Delmonico, placed on 10 day DL with fractured right hand,10, fractured right hand,547170.0,0
2018-05-20, Angels,Rene Rivera, placed on 10 day DL with right knee inflammation,10, right knee inflammation,425784.0,0
2018-05-20, Astros,Derek Fisher, placed on 10 day DL with gastrointestinal ailment,10, gastrointestinal ailment,605233.0,0
2018-05-22, Diamondbacks,Steven Souza Jr., placed on 10 day DL with strained right pectoral muscle,10, strained right pectoral muscle,519306.0,0
2018-05-23, Athletics,Khris Davis, placed on 10 day DL with strained right groin,10, strained right groin,501981.0,0
2018-05-24, White Sox,Leury Garcia, placed on 10 day DL with sprained left knee,10, sprained left knee,544725.0,0
2018-05-26, Marlins,Martin Prado, placed on 10 day DL with strained left hamstring,10, strained left hamstring,445988.0,0
2018-05-28, Padres,Franchy Cordero, placed on 10 day DL with strained right forearm,10, strained right forearm,614173.0,0
2018-05-29, Astros,Brian McCann, placed on 10 day DL with sore right knee,10, sore right knee,435263.0,0
2018-05-30, Brewers,Tyler Saladino, placed on 10 day DL with sprained left ankle,10, sprained left ankle,573135.0,0
2018-05-30, Dodgers,Chase Utley, placed on 10 day DL with sprained left thumb,10, sprained left thumb,400284.0,0
2018-05-30, Mariners,Chris Herrmann, placed on 10 day DL with bruised ribcage / strained right oblique,10, bruised ribcage / strained right oblique,543302.0,0
2018-05-30, Twins,Byron Buxton, placed on 10 day DL with fractured left big toe,10, fractured left big toe,621439.0,0
2018-05-31, Phillies,Rhys Hoskins, placed on 10 day DL with fractured jaw,10, fractured jaw,656555.0,0
2018-06-01, Rockies,David Dahl, placed on 10 day DL with fractured right foot,10, fractured right foot,621311.0,0
2018-06-02, Angels,Kole Calhoun, placed on 10 day DL with strained right oblique muscle,10, strained right oblique muscle,594777.0,0
2018-06-02, Giants,Brandon Belt, placed on 10 day DL with appendectomy,10, appendectomy,474832.0,0
2018-06-02, Red Sox,Dustin Pedroia, placed on 10 day DL with left knee inflammation,10, left knee inflammation,456030.0,0
2018-06-06, Athletics,Matt Joyce, placed on 10 day DL with lumbar strain in back,10, lumbar strain in back,459964.0,0
2018-06-08, Angels,Kaleb Cowart, placed on 10 day DL with sprained left ankle,10, sprained left ankle,592230.0,0
2018-06-09, Phillies,Dylan Cozens, placed on 10 day DL with strained left quadriceps,10, strained left quadriceps,622226.0,0
2018-06-12, Angels,Jefry Marte, placed on 10 day DL with sprained left wrist,10, sprained left wrist,527043.0,0
2018-06-15, Angels,Zack Cozart, placed on 10 day DL with left shoulder subluxation,10, left shoulder subluxation,446359.0,0
2018-06-15, Giants,Evan Longoria, placed on 10 day DL with fractured left hand,10, fractured left hand,446334.0,0
2018-06-16, Athletics,Matt Chapman, placed on 10 day DL with sore right hand / bruised right thumb,10, sore right hand / bruised right thumb,656305.0,0
2018-06-17, Royals,Jorge Soler, placed on 10 day DL with fractured left toe,10, fractured left toe,624585.0,0
2018-06-19, Mets,Jay Bruce, placed on 10 day DL with sore right hip,10, sore right hip,457803.0,0
2018-06-19, Nationals,Matt Adams, placed on 10 day DL with fractured left index finger,10, fractured left index finger,571431.0,0
2018-06-20, Phillies,J.P. Crawford, placed on 10 day DL with fractured left hand,10, fractured left hand,641487.0,0
2018-06-22, Pirates,Francisco Cervelli, placed on 7 day DL with concussion,7, concussion,465041.0,0
2018-06-25, Yankees,Gary Sanchez, placed on 10 day DL with strained right groin,10, strained right groin,596142.0,0
2018-06-26, Brewers,Lorenzo Cain, placed on 10 day DL with strained left groin,10, strained left groin,456715.0,0
2018-06-26, Cubs,Kris Bryant, placed on 10 day DL with left shoulder inflammation,10, left shoulder inflammation,592178.0,0
2018-06-26, Rangers,Ronald Guzman, placed on 7 day DL with concussion,7, concussion,608597.0,0
2018-06-27, Orioles,Craig Gentry, placed on 10 day DL with fractured left rib,10, fractured left rib,502226.0,0
2018-06-29, Astros,Carlos Correa, placed on 10 day DL with sore lower back,10, sore lower back,621043.0,0
2018-06-30, Diamondbacks,Deven Marrero, placed on 10 day DL with strained left oblique,10, strained left oblique,571918.0,0
2018-07-03, Astros,Brian McCann, placed on 10 day DL with strained right knee,10, strained right knee,435263.0,0
2018-07-03, Indians,Lonnie Chisenhall, placed on 10 day DL with strained left calf,10, strained left calf,502082.0,0
2018-07-03, Orioles,Colby Rasmus, placed on restricted list,0,unknown,458675.0,0
2018-07-04, Marlins,Lewis Brinson, placed on 10 day DL with right hip injury / left hip imflammation,10, right hip injury / left hip imflammation,621446.0,0
2018-07-05, Cardinals,Tyler O'Neill, placed on 10 day DL with strained left hamstring,10, strained left hamstring,641933.0,0
2018-07-05, Diamondbacks,Jarrod Dyson, placed on 10 day DL with strained right groin,10, strained right groin,502481.0,0
2018-07-05, Mariners,Mike Zunino, placed on 10 day DL with bone bruise in left ankle,10, bone bruise in left ankle,572287.0,0
2018-07-05, Yankees,Gleyber Torres, placed on 10 day DL with strained right hip,10, strained right hip,650402.0,0
2018-07-07, Athletics,Matt Joyce, placed on 10 day DL with lumbar strain,10, lumbar strain,459964.0,0
2018-07-07, Giants,Joe Panik, placed on 10 day DL with strained left groin,10, strained left groin,605412.0,0
2018-07-09, Dodgers,Yasiel Puig, placed on 10 day DL with strained right oblique muscle,10, strained right oblique muscle,624577.0,0
2018-07-10, White Sox,Avisail Garcia, placed on 10 day DL with strained right hamstring,10, strained right hamstring,541645.0,0
2018-07-12, Red Sox,Rafael Devers, placed on 10 day DL with left shoulder inflammation,10, left shoulder inflammation,646240.0,0
2018-07-12, Twins,Logan Morrison, placed on 10 day DL with bruised left hip / left hip impingement,10, bruised left hip / left hip impingement,489149.0,0
2018-07-14, Pirates,Francisco Cervelli, placed on 7 day DL with concussion,7, concussion,465041.0,0
2018-07-14, Brewers,Eric Thames, placed on 10 day DL with tightness in right hamstring,10, tightness in right hamstring,519346.0,0
2018-07-15, Blue Jays,Lourdes Gurriel Jr., placed on 7 day DL with concussion,7, concussion,666971.0,0
2018-07-15, Brewers,Jonathan Villar, placed on 10 day DL with sprained right thumb,10, sprained right thumb,542340.0,0
2018-07-17, Rays,Wilson Ramos, placed on 10 day DL with strained left hamstring,10, strained left hamstring,467092.0,0
2018-07-18, Reds,Scott Schebler, placed on 10 day DL with sprained AC joint in right shoulder,10, sprained AC joint in right shoulder,594988.0,0
2018-07-20, Rangers,Nomar Mazara, placed on 10 day DL with sprained right thumb,10, sprained right thumb,608577.0,0
2018-07-21, Rockies,D.J. LeMahieu, placed on 10 day DL with strained left oblique,10, strained left oblique,518934.0,0
2018-07-23, Cardinals,Kolten Wong, placed on 10 day DL with left knee inflammation,10, left knee inflammation,543939.0,0
2018-07-23, Marlins,Garrett Cooper, placed on 10 day DL with right wrist injury,10, right wrist injury,643265.0,0
2018-07-24, Mets,Yoenis Cespedes, placed on 10 day DL with twin heel calcifications,10, twin heel calcifications,493316.0,0
2018-07-24, Yankees,Gary Sanchez, placed on 10 day DL with strained right groin,10, strained right groin,596142.0,0
2018-07-26, Cubs,Kris Bryant, placed on 10 day DL with sore left shoulder / left shoulder inflammation,10, sore left shoulder / left shoulder inflammation,592178.0,0
2018-07-26, Giants,Brandon Belt, placed on 10 day DL with hyperextended left knee / hyperextended right knee,10, hyperextended left knee / hyperextended right knee,474832.0,0
2018-07-26, Reds,Jesse Winker, placed on 10 day DL with right shoulder subluxation,10, right shoulder subluxation,608385.0,0
2018-07-27, Yankees,Aaron Judge, placed on 10 day DL with fractured right wrist,10, fractured right wrist,592450.0,0
2018-07-28, Astros,Jose Altuve, placed on 10 day DL with sore right knee,10, sore right knee,514888.0,0
2018-07-28, Indians,Tyler Naquin, placed on 10 day DL with bruised / strained right hip,10, bruised / strained right hip,571980.0,0
2018-07-29, Red Sox,Rafael Devers, placed on 10 day DL with strained left hamstring,10, strained left hamstring,646240.0,0
2018-07-31, Royals,Brian Goodwin, placed on 10 day DL with strained left groin,10, strained left groin,571718.0,0
2018-08-01, Blue Jays,Lourdes Gurriel Jr.," placed on 10 day DL with sprained left ankle, knee",10," sprained left ankle, knee",666971.0,0
2018-08-02, Dodgers,Chase Utley, placed on 10 day DL with left wrist inflammation,10, left wrist inflammation,400284.0,0
2018-08-03, Rays,Tommy Pham, placed on 10 day DL with fractured right foot,10, fractured right foot,502054.0,0
2018-08-03, Red Sox,Blake Swihart, placed on 10 day DL with strained right hamstring,10, strained right hamstring,596119.0,0
2018-08-04, Cardinals,Dexter Fowler, placed on 10 day DL with fractured left foot,10, fractured left foot,451594.0,0
2018-08-04, Rangers,Delino DeShields Jr., placed on 7 day DL with concussion / post concussion syndrome,7, concussion / post concussion syndrome,592261.0,0
2018-08-06, Astros,George Springer, placed on 10 day DL with sprained left thumb,10, sprained left thumb,543807.0,0
2018-08-06, Cardinals,Tyler O'Neill, placed on 10 day DL with groin inflammation,10, groin inflammation,641933.0,0
2018-08-06, Twins,Robbie Grossman, placed on 10 day DL with strained right hamstring,10, strained right hamstring,543257.0,0
2018-08-06, White Sox,Leury Garcia, placed on 10 day DL with strained left hamstring,10, strained left hamstring,544725.0,0
2018-08-08, Tigers,John Hicks, placed on 10 day DL with strained right groin,10, strained right groin,543308.0,0
2018-08-10, Angels,Mike Trout, placed on 10 day DL with right wrist inflammation,10, right wrist inflammation,545361.0,0
2018-08-11, Astros,Jake Marisnick, placed on 10 day DL with left groin injury,10, left groin injury,545350.0,0
2018-08-11, Cardinals,Yairo Munoz, placed on 10 day DL with sprained right wrist,10, sprained right wrist,622168.0,0
2018-08-11, Twins,Logan Morrison, placed on 10 day DL with left hip impingement,10, left hip impingement,489149.0,0
2018-08-12, Blue Jays,Yangervis Solarte, placed on 10 day DL with strained right oblique,10, strained right oblique,500208.0,0
2018-08-12, Indians,Edwin Encarnacion, placed on 10 day DL with bruised right hand / left biceps inflammation,10, bruised right hand / left biceps inflammation,429665.0,0
2018-08-13, Marlins,Martin Prado, placed on 10 day DL with strained left quadriceps,10, strained left quadriceps,445988.0,0
2018-08-13, Tigers,JaCoby Jones, placed on 10 day DL with strained right hamstring,10, strained right hamstring,592444.0,0
2018-08-16, Pirates,Jordy Mercer, placed on 10 day DL with strained left calf,10, strained left calf,474568.0,0
2018-08-17, Rangers,Delino DeShields Jr., placed on 10 day DL with fractured right middle finger,10, fractured right middle finger,592261.0,0
2018-08-17, Red Sox,Rafael Devers, placed on 10 day DL with strained left hamstring,10, strained left hamstring,646240.0,0
2018-08-17, Reds,Joey Votto, placed on 10 day DL with bruised lower right leg,10, bruised lower right leg,458015.0,0
2018-08-20, Mets,Brandon Nimmo, placed on 10 day DL with bruised left index finger,10, bruised left index finger,607043.0,0
2018-08-20, Orioles,Mark Trumbo, placed on 10 day DL with right knee inflammation,10, right knee inflammation,444432.0,0
2018-08-21, Angels,Justin Upton, placed on 10 day DL with laceration on left index finger,10, laceration on left index finger,457708.0,0
2018-08-21, White Sox,Leury Garcia, placed on 10 day DL with strained left hamstring,10, strained left hamstring,544725.0,0
2018-08-22, Cardinals,Marcell Ozuna, placed on 10 day DL with right shoulder inflammation,10, right shoulder inflammation,542303.0,0
2018-08-22, Cubs,Addison Russell, placed on 10 day DL with sprained left middle finger,10, sprained left middle finger,608365.0,0
2018-08-22, Indians,Rajai Davis, placed on 10 day DL with medical condition,10, medical condition,434658.0,0
2018-08-23, Padres,Christian Villanueva, placed on 10 day DL with fractured right middle finger (out for season),10, fractured right middle finger (out for season),570799.0,0
2018-08-23, Phillies,Justin Bour, placed on 10 day DL with strained left oblique,10, strained left oblique,571506.0,0
2018-08-23, White Sox,Welington Castillo, placed on 10 day DL with right shoulder inflammation,10, right shoulder inflammation,456078.0,0
2018-08-24, Twins,Bobby Wilson, placed on 10 day DL with sprained right ankle,10, sprained right ankle,435064.0,0
2018-08-25, Rays,Mallex Smith, placed on 10 day DL with viral infection,10, viral infection,605480.0,0
2018-08-28, Cardinals,Kolten Wong, placed on 10 day DL with strained left hamstring,10, strained left hamstring,543939.0,0
2018-08-28, Orioles,Andrew Susac, placed on restricted list,0,unknown,572180.0,0
2018-08-29, Giants,Steven Duggar, placed on 10 day DL with right shoulder injury / torn labrum in left shoulder / bruised left shoulder (out for season),10, right shoulder injury / torn labrum in left shoulder / bruised left shoulder (out for season),621453.0,0
2018-08-30, Tigers,Jose Iglesias, placed on 10 day DL with strained lower abdominal muscle,10, strained lower abdominal muscle,578428.0,0
2018-08-31, Cubs,Jason Heyward, placed on 10 day DL with tightness in right hamstring,10, tightness in right hamstring,518792.0,0
2018-09-02, Braves,Michael Reed, placed on 60 day DL with strained left lower back,60, strained left lower back,605439.0,0
2018-09-03, Rays,Adam Moore, placed on restricted list,0,unknown,446192.0,0
2018-09-04, Marlins,Martin Prado, placed on 60 day DL with strained right abdominal muscle (out for season),60, strained right abdominal muscle (out for season),445988.0,0
2018-09-04, Cubs,Mark Zagunis, placed on 60 day DL with right shoulder inflammation (out for season),60, right shoulder inflammation (out for season),657145.0,0
2018-09-04, Rockies,Yonathan Daza, placed on 60 day DL with strained left shoulder (out for season),60, strained left shoulder (out for season),602074.0,0
2018-09-18, Pirates,Gregory Polanco, placed on 10 day DL with dislocated left shoulder / surgery on left shoulder to repair labrum (out for season),10, dislocated left shoulder / surgery on left shoulder to repair labrum (out for season),570256.0,0
2018-09-24, Orioles,Austin Hays, placed on 60 day DL recovering from surgery on right ankle (out for season),60,unknown,669720.0,0
2018-09-29, Diamondbacks,Christian Walker, placed on 60 day DL with facial fractures (out for season),60, facial fractures (out for season),572233.0,0
2019-03-03, Rangers,Scott Heineman, placed on 60 day IL recovering from surgery on left shoulder,60,unknown,595981.0,0
2019-03-11, Royals,Salvador Perez," placed on 60 day IL recovering from ligament replacement (""Tommy John"") surgery on elbow",60,unknown,521692.0,0
2019-03-18, Mariners,Kyle Seager, placed on 10 day IL recovering from surgery on left hand,10,unknown,572122.0,0
2019-03-19, Athletics,Chris Herrmann, placed on 60 day IL with surgery on right knee,60, surgery on right knee,543302.0,0
2019-03-19, Mariners,Mallex Smith, placed on temporarily inactive list,0,unknown,605480.0,0
2019-03-25, Blue Jays,Devon Travis, placed on 60 day IL recovering from surgery on left knee,60,unknown,581527.0,0
2019-03-25, Cardinals,Justin Williams (Paul), placed on 10 day IL with fractured second metacarpal in right hand,10, fractured second metacarpal in right hand,642211.0,0
2019-03-25, Orioles,Mark Trumbo, placed on 60 day IL with recovering from surgery on right knee,60, recovering from surgery on right knee,444432.0,0
2019-03-26, Blue Jays,Dalton Pompey, placed on 7 day IL with concussion,7, concussion,592647.0,0
2019-03-26, Tigers,JaCoby Jones, placed on 10 day IL with sprained left / right shoulder,10, sprained left / right shoulder,592444.0,0
2019-03-27, Nationals,Howie Kendrick, placed on 10 day IL with strained left hamstring,10, strained left hamstring,435062.0,0
2019-03-27, Padres,Travis Jankowski, placed on 60 day IL with fractured left wrist,60, fractured left wrist,608671.0,0
2019-03-27, Red Sox,Dustin Pedroia, placed on 10 day IL recovering from surgery on left knee,10,unknown,456030.0,0
2019-03-27, Red Sox,Steve Pearce, placed on 10 day IL with strained left calf,10, strained left calf,456665.0,0
2019-03-27, Twins,Miguel Sano, placed on 10 day IL with laceration on right heel,10, laceration on right heel,593934.0,0
2019-03-28, Angels,Justin Upton, placed on 10 day IL with turf toe on left foot,10, turf toe on left foot,457708.0,0
2019-03-28, Angels,Michael Hermosillo, placed on 10 day IL with core muscle injury,10, core muscle injury,641684.0,0
2019-03-28, Blue Jays,Jonathan Davis, placed on 10 day IL with sprained right ankle,10, sprained right ankle,641505.0,0
2019-03-28, Diamondbacks,Steven Souza Jr., placed on 10 day IL with surgery on left knee,10, surgery on left knee,519306.0,0
2019-03-28, Indians,Bradley Zimmer, placed on 10 day IL with recovering from surgery on right shoulder,10, recovering from surgery on right shoulder,605548.0,0
2019-03-28, Indians,Francisco Lindor," placed on 10 day IL with strained right calf, sprained left ankle",10," strained right calf, sprained left ankle",596019.0,0
2019-03-28, Indians,Jason Kipnis, placed on 10 day IL with strained right calf,10, strained right calf,543401.0,0
2019-03-28, Mets,Jed Lowrie, placed on 10 day IL with sprained left knee capsule,10, sprained left knee capsule,476704.0,0
2019-03-28, Mets,Travis d'Arnaud," placed on 10 day IL recovering from ligament replacement (""Tommy John"") surgery on right elbow",10,unknown,518595.0,0
2019-03-28, Mets,Yoenis Cespedes, placed on 10 day IL recovering from surgery on left and right heel,10,unknown,493316.0,0
2019-03-28, Pirates,Gregory Polanco, placed on 10 day IL recovering from surgery on left shoulder,10,unknown,570256.0,0
2019-03-28, Pirates,Lonnie Chisenhall, placed on 10 day IL with fractured right index finger,10, fractured right index finger,502082.0,0
2019-03-28, Yankees,Aaron Hicks, placed on 10 day IL with strained left lower back,10, strained left lower back,543305.0,0
2019-03-28, Yankees,Jacoby Ellsbury, placed on 10 day IL recovering fronm surgery on left hip,10,unknown,453056.0,0
2019-03-31, Marlins,Garrett Cooper, placed on 10 day IL with strained left calf,10, strained left calf,643265.0,0
2019-04-01, Rays,Joey Wendle, placed on 10 day IL with strained left hamstring,10, strained left hamstring,621563.0,0
2019-04-01, Rockies,Daniel Murphy, placed on 10 day IL with fractured left index finger,10, fractured left index finger,502517.0,0
2019-04-01, Yankees,Miguel Andujar, placed on 10 day IL with strained right shoulder,10, strained right shoulder,609280.0,0
2019-04-03, Nationals,Trea Turner, placed on 10 day IL with fractured right index finger,10, fractured right index finger,607208.0,0
2019-04-04, Yankees,Troy Tulowitzki, placed on 10 day IL with strained left calf,10, strained left calf,453064.0,0
2019-04-06, Braves,Brian McCann, placed on 10 day IL with strained right hamstring,10, strained right hamstring,435263.0,0
2019-04-06, Rockies,Ryan McMahon, placed on 10 day IL with sprained / strained left elbow,10, sprained / strained left elbow,641857.0,0
2019-04-07, Rangers,Ronald Guzman, placed on 10 day IL with strained right hamstring,10, strained right hamstring,608597.0,0
2019-04-08, Padres,Franchy Cordero, placed on 10 day IL with sprained right elbow,10, sprained right elbow,614173.0,0
2019-04-09, Rockies,David Dahl, placed on 10 day IL with strained abdominal,10, strained abdominal,621311.0,0
