Date,Team,Player,Notes,DL_length,Injury_Type,player_id,pitcher
2021-08-21, Brewers,Tyrone Taylor, placed on 10 day IL with strained right oblique,10, strained right oblique,621438.0,0
2021-08-22, Giants,Evan Longoria, placed on 10 day IL with COVID 19 adverse reaction,10, COVID 19 adverse reaction,446334.0,0
2021-08-24, Astros,Chas McCormick, placed on 10 day IL with sore left hand,10, sore left hand,676801.0,0
2021-08-24, Rangers,Jonah Heim, placed on 10 day IL with COVID 19,10, COVID 19,641680.0,0
2021-08-24, Giants,Evan Longoria, placed on 10 day IL with bruised right hand,10, bruised right hand,446334.0,0
2021-08-26, Giants,Donovan Solano, placed on 10 day IL with COVID 19 positive test,10, COVID 19 positive test,456781.0,0
2021-08-26, Phillies,Rhys Hoskins, placed on 10 day IL with surgery on lower abdominal / strained left groin,10, surgery on lower abdominal / strained left groin,656555.0,0
2021-08-27, Athletics,Seth Brown, placed on 10 day IL with COVID 19 positive test,10, COVID 19 positive test,664913.0,0
2021-08-28, Cubs,David Bote, placed on 10 day IL with sprained right ankle,10, sprained right ankle,623520.0,0
2021-08-28, Mariners,Jake Fraley, placed on 10 day IL with right shoulder inflammation,10, right shoulder inflammation,641584.0,0
2021-08-29, Astros,Jason Castro, placed on 10 day IL with discomfort in right knee,10, discomfort in right knee,488771.0,0
2021-08-31, Astros,Taylor Jones, placed on 10 day IL with COVID 19,10, COVID 19,622100.0,0
2021-08-31, Indians,Wilson Ramos, placed on 10 day IL with torn ACL in left knee,10, torn ACL in left knee,467092.0,0
2021-08-31, Mets,Tomas Nido, placed on 10 day IL with sprained left thumb,10, sprained left thumb,621512.0,0
2021-08-31, Pirates,Michael Chavis, placed on 10 day IL with strained right elbow,10, strained right elbow,656308.0,0
2021-09-01, Red Sox,Xander Bogaerts, placed on 10 day IL with COVID 19 positive test,10, COVID 19 positive test,593428.0,0
2021-09-01, Red Sox,Yairo Munoz, placed on 10 day IL with COVID 19 positive test,10, COVID 19 positive test,622168.0,0
2021-09-03, Red Sox,Jarren Duran, placed on 10 day IL with COVID 19,10, COVID 19,680776.0,0
2021-09-04, Giants,Alex Dickerson, placed on 10 day IL with strained right hamstring,10, strained right hamstring,543105.0,0
2021-09-04, Mets,Brandon Nimmo, placed on 10 day IL with strained right hamstring,10, strained right hamstring,607043.0,0
2021-09-04, Rockies,Connor Joe, placed on 10 day IL with strained right hamstring,10, strained right hamstring,656582.0,0
2021-09-05, Angels,Justin Upton, placed on 10 day IL with right lumbar strain,10, right lumbar strain,457708.0,0
2021-09-05, Brewers,Willy Adames, placed on 10 day IL with strained left quadriceps,10, strained left quadriceps,642715.0,0
2021-09-05, Dodgers,A.J. Pollock, placed on 10 day IL with strained right hamstring,10, strained right hamstring,572041.0,0
2021-09-05, Red Sox,Danny Santana, placed on 10 day IL with COVID 19 symptoms,10, COVID 19 symptoms,542454.0,0
2021-09-05, Royals,Cam Gallagher, placed on 10 day IL with left knee inflammation,10, left knee inflammation,595956.0,0
2021-09-08, Cubs,Michael Hermosillo, placed on 10 day IL with strained left forearm,10, strained left forearm,641684.0,0
2021-09-08, Marlins,Jesus Aguilar, placed on 10 day IL with left knee inflammation,10, left knee inflammation,542583.0,0
2021-09-10, Braves,Stephen Vogt, placed on 10 day IL with right hip inflammation (out for season),10, right hip inflammation (out for season),519390.0,0
2021-09-10, Dodgers,Billy McKinney, placed on 10 day IL with left hip impingement,10, left hip impingement,641856.0,0
2021-09-11, Phillies,Travis Jankowski, placed on 10 day IL with bruised right foot,10, bruised right foot,608671.0,0
2021-09-11, Red Sox,Danny Santana, placed on 10 day IL with COVID 19,10, COVID 19,542454.0,0
2021-09-14, Cubs,Jason Heyward, placed on 7 day IL with concussion,7, concussion,518792.0,0
2021-09-14, Orioles,Jorge Mateo, placed on 60 day IL with right lumbar inflammation,60, right lumbar inflammation,622761.0,0
2021-09-14, White Sox,Andrew Vaughn, placed on 10 day IL with lower back inflammation,10, lower back inflammation,683734.0,0
2021-09-15, Astros,Michael Brantley, placed on 10 day IL with sore right knee,10, sore right knee,488726.0,0
2021-09-17, Diamondbacks,Seth Beer, placed on 10 day IL with dislocated left shoulder,10, dislocated left shoulder,666179.0,0
2021-09-17, Marlins,Jorge Alfaro, placed on 10 day IL with strained left calf,10, strained left calf,595751.0,0
2021-09-17, Reds,Tyler Naquin, placed on 10 day IL with bruised ribs,10, bruised ribs,571980.0,0
2021-09-18, Rays,Kevin Kiermaier, placed on 10 day IL with COVID 19 symptoms,10, COVID 19 symptoms,595281.0,0
2021-09-18, Reds,Jesse Winker, placed on 10 day IL with strained intercostal,10, strained intercostal,608385.0,0
2021-09-18, Reds,Shogo Akiyama, placed on 10 day IL with strained right hamstring,10, strained right hamstring,673451.0,0
2021-09-18, Twins,Rob Refsnyder, placed on 10 day IL with right elbow impingement,10, right elbow impingement,608701.0,0
2021-09-19, Tigers,Derek Hill, placed on 10 day IL with sprained left knee,10, sprained left knee,656537.0,0
2021-09-20, Reds,Tyler Stephenson, placed on 10 day IL with COVID 19,10, COVID 19,663886.0,0
2021-09-20, Indians,Amed Rosario, placed on 10 day IL with COVID 19 intake testing,10, COVID 19 intake testing,642708.0,0
2021-09-21, Cubs,Alfonso Rivas, placed on 10 day IL with tendon injury in right middle finger,10, tendon injury in right middle finger,663845.0,0
2021-09-21, Dodgers,Cody Bellinger, placed on 10 day IL with fractured left rib,10, fractured left rib,641355.0,0
2021-09-22, Blue Jays,Breyvic Valera, placed on 10 day IL with COVID 19 contact tracing,10, COVID 19 contact tracing,591971.0,0
2021-09-22, Orioles,Ramon Urias, placed on 10 day IL with strained right adductor,10, strained right adductor,602104.0,0
2021-09-22, Reds,Mike Moustakas, placed on 10 day IL with plantar fasciitis in right foot,10, plantar fasciitis in right foot,519058.0,0
2021-09-24, Cubs,Robinson Chirinos, placed on 10 day IL with strained left oblique,10, strained left oblique,455139.0,0
2021-09-24, Padres,Austin Nola, placed on 10 day IL with strained left thumb,10, strained left thumb,543592.0,0
2021-09-26, Athletics,Elvis Andrus, placed on 10 day IL with fractured fibula in left leg,10, fractured fibula in left leg,462101.0,0
2021-09-26, Athletics,Jed Lowrie, placed on 10 day IL with sprained right hand,10, sprained right hand,476704.0,0
2021-09-26, Diamondbacks,Nick Ahmed, placed on 10 day IL with right shoulder inflammation,10, right shoulder inflammation,605113.0,0
2021-09-26, Tigers,Victor Reyes, placed on 10 day IL with strained right groin,10, strained right groin,622682.0,0
2021-09-26, White Sox,Brian Goodwin, placed on 10 day IL with lower back spasms (out for season),10, lower back spasms (out for season),571718.0,0
2021-09-28, Giants,Brandon Belt, placed on 10 day IL with fractured left thumb,10, fractured left thumb,474832.0,0
2021-09-28, Orioles,Anthony Santander, placed on 10 day IL with sprained right knee,10, sprained right knee,623993.0,0
2021-09-29, Cubs,Patrick Wisdom, placed on 10 day IL with undisclosed injury,10, undisclosed injury,621550.0,0
2021-09-29, Mets,Tomas Nido, placed on 10 day IL with sprained left thumb,10, sprained left thumb,621512.0,0
2021-09-29, Pirates,Ke'Bryan Hayes, placed on 10 day IL with sore left wrist,10, sore left wrist,663647.0,0
2021-09-30, Yankees,Luke Voit, placed on 10 day IL with left knee inflammation (out for season),10, left knee inflammation (out for season),572228.0,0
2021-10-01, Athletics,Vimael Machin, placed on 10 day IL with stomach illness,10, stomach illness,605353.0,0
2021-10-01, Cubs,David Bote, placed on 10 day IL with COVID 19,10, COVID 19,623520.0,0
2021-10-01, Cubs,Nico Hoerner, placed on 10 day IL with tightness in right oblique,10, tightness in right oblique,663538.0,0
2021-10-01, Marlins,Jesus Sanchez, placed on 10 day IL with strained right hamstring,10, strained right hamstring,660821.0,0
2021-10-03, Angels,Taylor Ward, placed on 10 day IL with strained adductor in right groin,10, strained adductor in right groin,621493.0,0
2021-10-03, Cubs,Willson Contreras, placed on 10 day IL with right hip inflammation,10, right hip inflammation,575929.0,0
2021-10-03, Yankees,D.J. LeMahieu, placed on 10 day IL with right hip injury / sports hernia,10, right hip injury / sports hernia,518934.0,0
2021-10-12, Braves,Jorge Soler, placed on 10 day IL with COVID 19 positive test,10, COVID 19 positive test,624585.0,0
2021-10-30, Astros,Jason Castro, placed on 10 day IL with COVID 19 positive test (out for season),10, COVID 19 positive test (out for season),488771.0,0
2022-03-19, Cubs,David Bote, placed on 60 day IL recovering from surgery on left shoulder,60,unknown,623520.0,0
2022-03-21, Nationals,Carter Kieboom, placed on 60 day IL with strained flexor mass in right forearm,60, strained flexor mass in right forearm,666198.0,0
2022-03-30, Diamondbacks,Nick Ahmed, placed on 10 day IL with discomfort in right shoulder / right shoulder inflammation,10, discomfort in right shoulder / right shoulder inflammation,605113.0,0
2022-03-30, Reds,Donovan Solano, placed on 10 day IL with strained left hamstring,10, strained left hamstring,456781.0,0
2022-04-05, Phillies,Odubel Herrera, placed on 10 day IL with strained oblique muscle,10, strained oblique muscle,546318.0,0
2022-04-05, Pirates,Anthony Alford, placed on 10 day IL with sprained right wrist,10, sprained right wrist,546990.0,0
2022-04-06, Angels,Taylor Ward, placed on 10 day IL with strained left groin,10, strained left groin,621493.0,0
2022-04-06, Tigers,Derek Hill, placed on 10 day IL with strained right hamstring,10, strained right hamstring,656537.0,0
2022-04-07, Astros,Jake Meyers, placed on 10 day IL recovering from surgery on left shoulder to repair torn labrum,10,unknown,676694.0,0
2022-04-07, Astros,Taylor Jones, placed on 10 day IL with discomfort in lower back,10, discomfort in lower back,622100.0,0
2022-04-07, Brewers,Luis Urias, placed on 10 day IL with strained left quadriceps,10, strained left quadriceps,649966.0,0
2022-04-07, Giants,Evan Longoria, placed on 10 day IL recovering from surgery on right index finger to repair ligament,10,unknown,446334.0,0
2022-04-07, Guardians,Josh Naylor, placed on 10 day IL recovering from surgery on right ankle,10,unknown,647304.0,0
2022-04-07, Mariners,Evan White, placed on 10 day IL with surgery to repair sports hernia,10, surgery to repair sports hernia,657108.0,0
2022-04-07, Mariners,Kyle Lewis, placed on 10 day IL recovering from surgery on right knee to repair torn meniscus,10,unknown,641786.0,0
2022-04-07, Padres,Fernando Tatis Jr., placed on 60 day IL with fractured left wrist,60, fractured left wrist,665487.0,0
2022-04-07, Pirates,Greg Allen, placed on 60 day IL with strained left hamstring,60, strained left hamstring,656185.0,0
2022-04-07, Reds,Jose Barrero, placed on 10 day IL with surgery on left hand to repair hamate bone,10, surgery on left hand to repair hamate bone,676480.0,0
2022-04-07, White Sox,Yoan Moncada, placed on 10 day IL with strained right oblique,10, strained right oblique,660162.0,0
2022-04-07, Yankees,Ben Rortvedt, placed on 10 day IL with strained right oblique muscle,10, strained right oblique muscle,666163.0,0
2022-04-08, Phillies,Mickey Moniak, placed on 10 day IL with fractured right hand,10, fractured right hand,666160.0,0
2022-04-10, Athletics,Skye Bolt, placed on 10 day IL with strained right oblique,10, strained right oblique,621450.0,0
2022-04-11, Blue Jays,Danny Jansen, placed on 10 day IL with strain left oblique,10, strain left oblique,643376.0,0
2022-04-12, Angels,David Fletcher, placed on 10 day IL with strained left hip,10, strained left hip,664058.0,0
2022-04-12, White Sox,A.J. Pollock, placed on 10 day IL with strained right hamstring,10, strained right hamstring,572041.0,0
2022-04-13, Twins,Alex Kirilloff, placed on 10 day IL with right wrist inflammation,10, right wrist inflammation,666135.0,0
2022-04-14, Blue Jays,Teoscar Hernandez, placed on 10 day IL with strained left oblique,10, strained left oblique,606192.0,0
2022-04-15, Astros,Yordan Alvarez, placed on 10 day IL with COVID 19,10, COVID 19,670541.0,0
2022-04-15, Athletics,Stephen Piscotty, placed on 10 day IL with COVID 19,10, COVID 19,572039.0,0
2022-04-15, Mets,Brandon Nimmo, placed on 10 day IL with COVID 19 positive test,10, COVID 19 positive test,607043.0,0
2022-04-15, Mets,Mark Canha, placed on 10 day IL with COVID 19,10, COVID 19,592192.0,0
2022-04-16, Mariners,Mitch Haniger, placed on 10 day IL with COVID 19 positive test,10, COVID 19 positive test,571745.0,0
2022-04-16, Reds,Nick Senzel, placed on 10 day IL with illness / COVID 19,10, illness / COVID 19,669222.0,0
2022-04-16, Tigers,Javier Baez, placed on 10 day IL with sore right thumb,10, sore right thumb,595879.0,0
2022-04-17, Rockies,Garrett Hampson, placed on 10 day IL with bruised right hand,10, bruised right hand,641658.0,0
2022-04-18, Athletics,Jed Lowrie, placed on 10 day IL with COVID 19 positive test,10, COVID 19 positive test,476704.0,0
2022-04-18, Reds,Tyler Naquin, placed on 10 day IL with COVID 19,10, COVID 19,571980.0,0
2022-04-18, Athletics,Austin Allen, placed on 10 day IL with COVID 19,10, COVID 19,664119.0,0
2022-04-19, Reds,Jonathan India, placed on 10 day IL with strained right hamstring,10, strained right hamstring,663697.0,0
2022-04-19, Reds,Mike Moustakas, placed on 10 day IL with strained right biceps,10, strained right biceps,519058.0,0
2022-04-20, Astros,Jose Altuve, placed on 10 day IL with strained left hamstring,10, strained left hamstring,514888.0,0
2022-04-20, Guardians,Owen Miller, placed on 10 day IL with COVID 19,10, COVID 19,680911.0,0
2022-04-20, Reds,Tyler Stephenson, placed on 7 day IL with concussion,7, concussion,663886.0,0
2022-04-21, Athletics,Stephen Vogt, placed on 10 day IL with sprained right knee,10, sprained right knee,519390.0,0
2022-04-22, Giants,Steven Duggar, placed on 60 day IL with strained left oblique,60, strained left oblique,621453.0,0
2022-04-22, Tigers,Victor Reyes, placed on 10 day IL with strained left quadriceps,10, strained left quadriceps,622682.0,0
2022-04-23, Athletics,Drew Jackson, placed on 10 day IL with COVID 19,10, COVID 19,623515.0,0
2022-04-23, Rays,Yandy Diaz, placed on 10 day IL with COVID 19 symptoms,10, COVID 19 symptoms,650490.0,0
2022-04-24, Padres,Luke Voit, placed on 10 day IL with strained right biceps,10, strained right biceps,572228.0,0
2022-04-24, White Sox,Eloy Jimenez, placed on 10 day IL with strained right hamstring,10, strained right hamstring,650391.0,0
2022-04-25, Blue Jays,Cavan Biggio, placed on 10 day IL with COVID 19 symptoms,10, COVID 19 symptoms,624415.0,0
2022-04-26, Braves,Eddie Rosario," placed on 10 day IL with blurred vision, swollen retina in right eye",10," blurred vision, swollen retina in right eye",592696.0,0
2022-04-26, Pirates,Bryan Reynolds, placed on 10 day IL with COVID 19,10, COVID 19,668804.0,0
2022-04-26, Pirates,Cole Tucker, placed on 10 day IL with COVID 19,10, COVID 19,657061.0,0
2022-04-27, Pirates,Kevin Newman, placed on 10 day IL with strained left groin,10, strained left groin,621028.0,0
2022-04-29, Giants,Brandon Belt, placed on 10 day IL with COVID 19,10, COVID 19,474832.0,0
2022-04-29, Rockies,Kris Bryant, placed on 10 day IL with strained back,10, strained back,592178.0,0
2022-04-30, Mariners,Mitch Haniger, placed on 10 day IL with right high ankle sprain,10, right high ankle sprain,571745.0,0
2022-05-01, Reds,Jake Fraley, placed on 10 day IL with right knee inflammation,10, right knee inflammation,641584.0,0
2022-05-01, Reds,Jonathan India, placed on 10 day IL with tightness in right hamstring,10, tightness in right hamstring,663697.0,0
2022-05-02, Royals,Cam Gallagher, placed on 10 day IL with strained left hamstring,10, strained left hamstring,595956.0,0
2022-05-02, Twins,Kyle Garlick, placed on 10 day IL with strained right calf,10, strained right calf,664247.0,0
2022-05-02, Twins,Miguel Sano, placed on 10 day IL with surgery on left knee to repair torn meniscus,10, surgery on left knee to repair torn meniscus,593934.0,0
2022-05-03, Cardinals,Edmundo Sosa, placed on 10 day IL with COVID 19 positive test,10, COVID 19 positive test,624641.0,0
2022-05-03, Reds,Joey Votto, placed on 10 day IL with COVID 19 symptoms,10, COVID 19 symptoms,458015.0,0
2022-05-04, Reds,Nick Senzel, placed on 10 day IL with COVID 19 positive test,10, COVID 19 positive test,669222.0,0
2022-05-04, Reds,Tyler Naquin, placed on 10 day IL with COVID 19,10, COVID 19,571980.0,0
2022-05-05, White Sox,Andrew Vaughn, placed on 10 day IL with bruised right hand,10, bruised right hand,683734.0,0
2022-05-06, Twins,Luis Arraez, placed on 10 day IL with COVID 19 positive test,10, COVID 19 positive test,650333.0,0
2022-05-07, Angels,Kurt Suzuki, placed on 10 day IL with COVID 19 positive test,10, COVID 19 positive test,435559.0,0
2022-05-07, Brewers,Andrew McCutchen, placed on 10 day IL with COVID 19 positive test,10, COVID 19 positive test,457705.0,0
2022-05-07, Marlins,Jon Berti, placed on 10 day IL with COVID 19 positive test,10, COVID 19 positive test,542932.0,0
2022-05-08, Angels,David Fletcher, placed on 10 day IL with strained left hip,10, strained left hip,664058.0,0
2022-05-08, Athletics,Stephen Piscotty, placed on 10 day IL with tightness in left calf,10, tightness in left calf,572039.0,0
2022-05-08, Twins,Trevor Larnach, placed on 10 day IL with strained right groin,10, strained right groin,663616.0,0
2022-05-08, Yankees,Tim Locastro, placed on 10 day IL strained left lat muscle,10,unknown,641796.0,0
2022-05-09, Reds,Mike Moustakas, placed on 10 day IL with COVID 19,10, COVID 19,519058.0,0
2022-05-09, Royals,Edward Olivares, placed on 10 day IL with strained right quadriceps,10, strained right quadriceps,658668.0,0
2022-05-10, Cubs,Michael Hermosillo, placed on 10 day IL with strained left quadriceps,10, strained left quadriceps,641684.0,0
2022-05-10, Cubs,Nick Madrigal, placed on 10 day IL with strained lower back,10, strained lower back,663611.0,0
2022-05-10, Pirates,Jake Marisnick, placed on 10 day IL with ligament damage in left thumb,10, ligament damage in left thumb,545350.0,0
2022-05-10, Twins,Carlos Correa, placed on 10 day IL with bruised right middle finger,10, bruised right middle finger,621043.0,0
2022-05-13, Guardians,Josh Naylor, placed on 10 day IL with COVID 19,10, COVID 19,647304.0,0
2022-05-13, Marlins,Joey Wendle, placed on 10 day IL with strained right hamstring,10, strained right hamstring,621563.0,0
2022-05-13, Orioles,Ryan Mountcastle, placed on 10 day IL with strained left forearm/wrist,10, strained left forearm/wrist,663624.0,0
2022-05-15, Cubs,Nico Hoerner, placed on 10 day IL with sprained right ankle,10, sprained right ankle,663538.0,0
2022-05-15, Rays,Manuel Margot, placed on 10 day IL with strained right hamstring,10, strained right hamstring,622534.0,0
2022-05-16, Diamondbacks,Nick Ahmed, placed on 10 day IL with COVID 19 positive test,10, COVID 19 positive test,605113.0,0
2022-05-16, Tigers,Austin Meadows, placed on 10 day IL with vertigo,10, vertigo,640457.0,0
2022-05-16, Tigers,Victor Reyes, placed on 10 day IL with strained right quadriceps,10, strained right quadriceps,622682.0,0
2022-05-17, Cubs,Jason Heyward, placed on 10 day IL with COVID 19 positive test,10, COVID 19 positive test,518792.0,0
2022-05-17, Royals,Salvador Perez, placed on 10 day IL with with sprained left thumb,10, ,521692.0,0
2022-05-18, Brewers,Willy Adames, placed on 10 day IL with high left ankle sprain,10, high left ankle sprain,642715.0,0
2022-05-18, Diamondbacks,Cooper Hummel, placed on 10 day IL with COVID 19,10, COVID 19,669450.0,0
2022-05-18, Cubs,Michael Hermosillo, placed on 10 day IL with COVID 19 positive test,10, COVID 19 positive test,641684.0,0
2022-05-20, Cardinals,Tyler O'Neill, placed on 10 day IL with right shoulder impingement,10, right shoulder impingement,641933.0,0
2022-05-21, Giants,Curt Casali, placed on 7 day IL with concussion,7, concussion,592200.0,0
2022-05-22, Giants,Brandon Belt, placed on 10 day IL with right knee inflammation,10, right knee inflammation,474832.0,0
2022-05-22, Yankees,Joey Gallo, placed on 10 day IL with COVID 19,10, COVID 19,608336.0,0
2022-05-22, Yankees,Kyle Higashioka, placed on 10 day IL with COVID 19,10, COVID 19,543309.0,0
2022-05-23, Cardinals,Dylan Carlson, placed on 10 day IL with strained left hamstring,10, strained left hamstring,666185.0,0
2022-05-24, Brewers,Hunter Renfroe, placed on 10 day IL with strained right hamstring,10, strained right hamstring,592669.0,0
2022-05-24, Pirates,Daniel Vogelbach, placed on 10 day IL with strained left hamstring,10, strained left hamstring,596129.0,0
2022-05-24, White Sox,Luis Robert Jr., placed on 10 day IL with COVID 19,10, COVID 19,673357.0,0
2022-05-25, Cubs,Yan Gomes, placed on 10 day IL with strained left oblique muscle,10, strained left oblique muscle,543228.0,0
2022-05-25, Rockies,Kris Bryant, placed on 10 day IL with strained lower back,10, strained lower back,592178.0,0
2022-05-26, Royals,Kyle Isbel, placed on 10 day IL with COVID 19,10, COVID 19,664728.0,0
2022-05-27, Marlins,Avisail Garcia, placed on 10 day IL with COVID 19,10, COVID 19,541645.0,0
2022-05-27, Mets,Travis Jankowski, placed on 10 day IL with fractured fourth metacarpal in left hand,10, fractured fourth metacarpal in left hand,608671.0,0
2022-05-27, Twins,Gilberto Celestino, placed on 10 day IL with COVID 19,10, COVID 19,665482.0,0
2022-05-28, Angels,Anthony Rendon, placed on 10 day IL with right wrist inflammation,10, right wrist inflammation,543685.0,0
2022-05-29, Pirates,Ben Gamel, placed on 10 day IL with strained left hamstring,10, strained left hamstring,592325.0,0
2022-05-29, Twins,Royce Lewis, placed on 10 day IL with bone bruise in right knee,10, bone bruise in right knee,668904.0,0
2022-05-30, Cubs,Seiya Suzuki, placed on 10 day IL with sprained left ring finger,10, sprained left ring finger,673548.0,0
2022-05-30, Tigers,Robbie Grossman, placed on 10 day IL with strained neck,10, strained neck,543257.0,0
2022-05-30, Cubs,Jonathan Villar, placed on 10 day IL with mouth injury,10, mouth injury,542340.0,0
2022-05-31, Twins,Carlos Correa, placed on 10 day IL with COVID 19 positive test,10, COVID 19 positive test,621043.0,0
2022-06-01, Mariners,Kyle Lewis, placed on 7 day IL with concussion,7, concussion,641786.0,0
2022-06-01, Marlins,Joey Wendle, placed on 10 day IL with strained right hamstring,10, strained right hamstring,621563.0,0
2022-06-01, Phillies,Jean Segura, placed on 10 day IL with fractured right index finger,10, fractured right index finger,516416.0,0
2022-06-01, Reds,Tyler Naquin, placed on 10 day IL with strained left quadriceps,10, strained left quadriceps,571980.0,0
2022-06-02, Brewers,Omar Narvaez, placed on 10 day IL with COVID 19 positive test,10, COVID 19 positive test,553882.0,0
2022-06-03, Dodgers,Edwin Rios, placed on 10 day IL with strained right hamstring,10, strained right hamstring,621458.0,0
2022-06-05, Angels,Taylor Ward, placed on 10 day IL with strained right hamstring,10, strained right hamstring,621493.0,0
2022-06-06, Reds,Mike Moustakas, placed on 10 day IL with COVID 19,10, COVID 19,519058.0,0
2022-06-07, Blue Jays,Danny Jansen, placed on 10 day IL with fractured finger on left hand,10, fractured finger on left hand,643376.0,0
2022-06-07, Phillies,Johan Camargo, placed on 10 day IL with strained right knee,10, strained right knee,622666.0,0
2022-06-07, Tigers,Jeimer Candelario, placed on 10 day IL with left shoulder subluxation,10, left shoulder subluxation,600869.0,0
2022-06-07, Twins,Kyle Garlick, placed on 10 day IL with strained left hamstring,10, strained left hamstring,664247.0,0
2022-06-08, Diamondbacks,Nick Ahmed, placed on 60 day IL with right shoulder inflammation,60, right shoulder inflammation,605113.0,0
2022-06-10, Brewers,Alex Jackson, placed on 10 day IL with sprained left middle finger,10, sprained left middle finger,656577.0,0
2022-06-10, Rays,Mike Zunino, placed on 10 day IL with left shoulder inflammation,10, left shoulder inflammation,572287.0,0
2022-06-10, Reds,Tyler Stephenson, placed on 10 day IL with fractured right thumb,10, fractured right thumb,663886.0,0
2022-06-10, Tigers,Daz Cameron, placed on 10 day IL with COVID 19 exposure,10, COVID 19 exposure,663662.0,0
2022-06-11, Brewers,Kolten Wong, placed on 10 day IL with strained right calf,10, strained right calf,543939.0,0
2022-06-11, Marlins,Garrett Cooper, placed on 10 day IL with COVID 19,10, COVID 19,643265.0,0
2022-06-11, Orioles,Ramon Urias, placed on 10 day IL with strained left oblique,10, strained left oblique,602104.0,0
2022-06-11, Rangers,Steele Walker, placed on 10 day IL with COVID 19,10, COVID 19,667727.0,0
2022-06-13, Reds,Aristides Aquino, placed on 10 day IL with strained left calf,10, strained left calf,606157.0,0
2022-06-13, White Sox,Yasmani Grandal, placed on 10 day IL with lower back spasms,10, lower back spasms,518735.0,0
2022-06-15, Cubs,Nick Madrigal, placed on 10 day IL with strained left groin,10, strained left groin,663611.0,0
2022-06-16, Rockies,Garrett Hampson, placed on 10 day IL with COVID 19,10, COVID 19,641658.0,0
2022-06-16, Twins,Jorge Polanco, placed on 10 day IL with tightness in lower back,10, tightness in lower back,593871.0,0
2022-06-17, Angels,Anthony Rendon, placed on 10 day IL with surgery on right wrist,10, surgery on right wrist,543685.0,0
2022-06-17, Marlins,Jesus Aguilar, placed on 10 day IL with COVID 19,10, COVID 19,542583.0,0
2022-06-17, Marlins,Jesus Sanchez, placed on 10 day IL with COVID 19,10, COVID 19,660821.0,0
2022-06-17, Pirates,Canaan Smith-Njigba, placed on 60 day IL with fractured right wrist,60, fractured right wrist,675986.0,0
2022-06-17, Pirates,Tucupita Marcano, placed on 10 day IL with COVID 19,10, COVID 19,672779.0,0
