Date,Team,Player,Notes,DL_length,Injury_Type,player_id,pitcher
2020-07-23, Pirates,J.T. Riddle, placed on 10 day IL with strained right abdominal,10, strained right abdominal,595375.0,0
2020-07-23, Rays,Randy Arozarena, placed on 10 day IL with undisclosed injury,10, undisclosed injury,668227.0,0
2020-07-24, Braves,Travis d'Arnaud, placed on 10 day IL with COVID 19 coronavirus,10, COVID 19 coronavirus,518595.0,0
2020-07-24, Braves,Tyler Flowers, placed on 10 day IL with COVID 19 coronavirus,10, COVID 19 coronavirus,452095.0,0
2020-07-24, Marlins,Jorge Alfaro, placed on 10 day IL with COVID 19 coronavirus,10, COVID 19 coronavirus,595751.0,0
2020-07-25, Astros,Aledmys Diaz, placed on 10 day IL with strained right groin,10, strained right groin,649557.0,0
2020-07-25, Indians,Tyler Naquin, placed on 10 day IL with hairline fracture in right big toe,10, hairline fracture in right big toe,571980.0,0
2020-07-26, Reds,Mike Moustakas, placed on 10 day IL with illness,10, illness,519058.0,0
2020-07-27, Braves,Scott Schebler, placed on 10 day IL,10,unknown,594988.0,0
2020-07-27, Marlins,Garrett Cooper, placed on 10 day IL with COVID 19 coronavirus,10, COVID 19 coronavirus,643265.0,0
2020-07-27, Marlins,Harold Ramirez, placed on 10 day IL with COVID 19 coronavirus,10, COVID 19 coronavirus,623912.0,0
2020-07-29, Mets,Jake Marisnick, placed on 10 day IL with strained left hamstring,10, strained left hamstring,545350.0,0
2020-07-31, Mets,Rene Rivera, placed on 10 day IL with hyperextended left elbow,10, hyperextended left elbow,425784.0,0
2020-07-31, Tigers,Cameron Maybin, placed on 10 day IL with strained right quadriceps,10, strained right quadriceps,457727.0,0
2020-08-01, Padres,Eric Hosmer, placed on 10 day IL with stomach gastritis,10, stomach gastritis,543333.0,0
2020-08-01, Rays,Kevan Smith, placed on 10 day IL with COVID 19 coronavirus,10, COVID 19 coronavirus,607345.0,0
2020-08-02, Rangers,Danny Santana, placed on 10 day IL with strained right forearm,10, strained right forearm,542454.0,0
2020-08-02, Reds,Joey Votto, placed on 10 day IL with illness,10, illness,458015.0,0
2020-08-04, Cardinals,Edmundo Sosa, placed on 10 day IL with COVID 19 coronavirus,10, COVID 19 coronavirus,624641.0,0
2020-08-04, Cardinals,Paul DeJong, placed on 10 day IL with COVID 19 coronavirus,10, COVID 19 coronavirus,657557.0,0
2020-08-04, Marlins,Chad Wallach, placed on 10 day IL with COVID 19 coronavirus,10, COVID 19 coronavirus,595453.0,0
2020-08-04, Mets,Robinson Cano, placed on 10 day IL with strained adductor in left shoulder,10, strained adductor in left shoulder,429664.0,0
2020-08-04, Rangers,Greg Bird, placed on 10 day IL with strained right calf,10, strained right calf,595885.0,0
2020-08-05, Blue Jays,Derek Fisher, placed on 10 day IL with strained left quadriceps,10, strained left quadriceps,605233.0,0
2020-08-05, Braves,Matt Adams, placed on 10 day IL with strained left hamstring,10, strained left hamstring,571431.0,0
2020-08-05, Cardinals,Rangel Ravelo, placed on 10 day IL with COVID 19 coronavirus,10, COVID 19 coronavirus,592660.0,0
2020-08-05, Royals,Bubba Starling, placed on 10 day IL,10,unknown,605490.0,0
2020-08-06, White Sox,Nick Madrigal, placed on 10 day IL with separated left shoulder,10, separated left shoulder,663611.0,0
2020-08-07, Tigers,Troy Stokes Jr., placed on 60 day IL with fractured hamate bone in hand,60, fractured hamate bone in hand,657011.0,0
2020-08-07, Rays,Manuel Margot, placed on 10 day IL with COVID 19 coronavirus intake testing,10, COVID 19 coronavirus intake testing,622534.0,0
2020-08-08, Royals,Nick Heath, placed on 10 day IL with strained left hamstring,10, strained left hamstring,670084.0,0
2020-08-08, Yankees,Kyle Higashioka, placed on 10 day IL with strained right oblique muscle,10, strained right oblique muscle,543309.0,0
2020-08-09, Reds,Mike Moustakas, placed on 10 day IL with bruised left quadricep,10, bruised left quadricep,519058.0,0
2020-08-09, Royals,Franchy Cordero, placed on 10 day IL with sprained right wrist,10, sprained right wrist,614173.0,0
2020-08-11, Tigers,C.J. Cron, placed on 10 day IL with sprained left knee,10, sprained left knee,543068.0,0
2020-08-11, White Sox,Leury Garcia, placed on 10 day IL with sprained left thumb,10, sprained left thumb,544725.0,0
2020-08-12, Red Sox,Andrew Benintendi, placed on 10 day IL with strained right ribcage,10, strained right ribcage,643217.0,0
2020-08-13, Phillies,Adam Haseley, placed on 10 day IL with sprained left wrist,10, sprained left wrist,656514.0,0
2020-08-14, Nationals,Starlin Castro, placed on 10 day IL with fractured right wrist,10, fractured right wrist,516770.0,0
2020-08-14, Rangers,Robinson Chirinos, placed on 10 day IL with sprained right ankle,10, sprained right ankle,455139.0,0
2020-08-14, Yankees,Aaron Judge, placed on 10 day IL with strained right calf,10, strained right calf,592450.0,0
2020-08-15, Astros,Michael Brantley, placed on 10 day IL with sore right quadriceps,10, sore right quadriceps,488726.0,0
2020-08-15, Cardinals,Austin Dean, placed on 10 day IL with COVID 19 coronavirus,10, COVID 19 coronavirus,621573.0,0
2020-08-15, Orioles,Austin Hays, placed on 10 day IL with fractured ribs,10, fractured ribs,669720.0,0
2020-08-16, Blue Jays,Bo Bichette, placed on 10 day IL with sprained right knee,10, sprained right knee,666182.0,0
2020-08-16, Yankees,D.J. LeMahieu, placed on 10 day IL with sprained left thumb,10, sprained left thumb,518934.0,0
2020-08-17, Dodgers,Edwin Rios, placed on 10 day IL with strained left hamstring,10, strained left hamstring,621458.0,0
2020-08-17, Padres,Tommy Pham, placed on 10 day IL with fractured hamate bone in right hand,10, fractured hamate bone in right hand,502054.0,0
2020-08-17, Rays,Esteban Quiroz, placed on 10 day IL with fractured hamate bone in left hand,10, fractured hamate bone in left hand,606019.0,0
2020-08-17, White Sox,Adam Engel, placed on 10 day IL with exposure to COVID 19 coronavirus,10, exposure to COVID 19 coronavirus,641553.0,0
2020-08-18, Astros,Yordan Alvarez, placed on 10 day IL with surgery on right knee to repair ligament damage,10, surgery on right knee to repair ligament damage,670541.0,0
2020-08-18, Braves,Nick Markakis, placed on 10 day IL with exposure to COVID 19 coronavirus,10, exposure to COVID 19 coronavirus,455976.0,0
2020-08-18, Cubs,Steven Souza Jr., placed on 10 day IL with strained right hamstring,10, strained right hamstring,519306.0,0
2020-08-18, Orioles,Jose Iglesias, placed on 10 day IL with strained left quadriceps,10, strained left quadriceps,578428.0,0
2020-08-19, Reds,Nick Senzel, placed on 10 day IL with undisclosed injury,10, undisclosed injury,669222.0,0
2020-08-19, Rockies,David Dahl, placed on 10 day IL with sore lower back,10, sore lower back,621311.0,0
2020-08-20, Astros,Alex Bregman, placed on 10 day IL with sore right hamstring,10, sore right hamstring,608324.0,0
2020-08-20, Cardinals,Matt Wieters, placed on 10 day IL with bruised left big toe,10, bruised left big toe,446308.0,0
2020-08-20, Rangers,Elvis Andrus, placed on 10 day IL with strained lower back,10, strained lower back,462101.0,0
2020-08-20, Rangers,Willie Calhoun, placed on 10 day IL with strained left hamstring,10, strained left hamstring,641432.0,0
2020-08-20, Twins,Byron Buxton, placed on 10 day IL with left shoulder inflammation,10, left shoulder inflammation,621439.0,0
2020-08-21, Royals,Salvador Perez, placed on 10 day IL with central serous chorioretinopathy in left eye,10, central serous chorioretinopathy in left eye,521692.0,0
2020-08-22, Cubs,Kris Bryant, placed on 10 day IL with sprained ring finger on left hand,10, sprained ring finger on left hand,592178.0,0
2020-08-22, Phillies,Jay Bruce, placed on 10 day IL with strained left quadriceps,10, strained left quadriceps,457803.0,0
2020-08-23, Marlins,Francisco Cervelli, placed on 7 day IL with concussion (out for season),7, concussion (out for season),465041.0,0
2020-08-24, Yankees,Gleyber Torres, placed on 10 day IL with strained left hamstring / quadriceps,10, strained left hamstring / quadriceps,650402.0,0
2020-08-25, Mets,Andres Gimenez, placed on 10 day IL,10,unknown,665926.0,0
2020-08-25, Mets,Tomas Nido, placed on 10 day IL (out for season),10,unknown,621512.0,0
2020-08-26, Marlins,Magneuris Sierra, placed on 10 day IL with strained right hamstring,10, strained right hamstring,642423.0,0
2020-08-27, Pirates,Colin Moran, placed on 7 day IL with concussion,7, concussion,592567.0,0
2020-08-28, Pirates,Anthony Alford, placed on 10 day IL with COVID 19 coronavirus intake testing (date approximate),10, COVID 19 coronavirus intake testing (date approximate),546990.0,0
2020-08-28, Rangers,Danny Santana, placed on 10 day IL with sprained right elbow (surgery),10, sprained right elbow (surgery),542454.0,0
2020-08-28, Yankees,Aaron Judge, placed on 10 day IL with strained right calf,10, strained right calf,592450.0,0
2020-08-29, Angels,Franklin Barreto, placed on 10 day IL with COVID 19 coronavirus intake testing,10, COVID 19 coronavirus intake testing,620439.0,0
2020-08-29, Rays,Mike Zunino, placed on 10 day IL with strained left oblique muscle,10, strained left oblique muscle,572287.0,0
2020-08-31, Giants,Joey Rickard, placed on 60 day IL with left elbow inflammation,60, left elbow inflammation,572073.0,0
2020-08-31, Rangers,Rougned Odor, placed on 10 day IL with right eye infection,10, right eye infection,596059.0,0
2020-08-31, Rockies,Brendan Rodgers, placed on 10 day IL with strained capsular in right shoulder,10, strained capsular in right shoulder,663898.0,0
2020-09-01, Rays,Yandy Diaz, placed on 10 day IL with strained right hamstring,10, strained right hamstring,650490.0,0
2020-09-02, Cardinals,Dexter Fowler, placed on 10 day IL with stomach ailment,10, stomach ailment,451594.0,0
2020-09-02, Tigers,JaCoby Jones, placed on 10 day IL with fractured left hand,10, fractured left hand,592444.0,0
2020-09-03, Angels,David Fletcher, placed on 10 day IL with sprained left ankle,10, sprained left ankle,664058.0,0
2020-09-04, Twins,Max Kepler, placed on 10 day IL with strained left adductor,10, strained left adductor,596146.0,0
2020-09-05, Astros,Jose Altuve, placed on 10 day IL with sprained right knee,10, sprained right knee,514888.0,0
2020-09-05, Orioles,Anthony Santander, placed on 10 day IL with strained right oblique muscle,10, strained right oblique muscle,623993.0,0
2020-09-05, Tigers,Niko Goodrum, placed on 10 day IL with strained right oblique muscle,10, strained right oblique muscle,592348.0,0
2020-09-06, Marlins,Harold Ramirez, placed on 10 day IL with strained left hamstring,10, strained left hamstring,623912.0,0
2020-09-06, Phillies,Jay Bruce, placed on 10 day IL with strained left quadriceps,10, strained left quadriceps,457803.0,0
2020-09-06, Pirates,Anthony Alford, placed on 10 day / 60 day IL with fractured right elbow,60, fractured right elbow,546990.0,0
2020-09-07, Blue Jays,Teoscar Hernandez, placed on 10 day IL with strained left oblique,10, strained left oblique,606192.0,0
2020-09-07, Mariners,Sam Haggerty, placed on 10 day IL with strained left forearm,10, strained left forearm,664059.0,0
2020-09-08, Angels,Franklin Barreto, placed on 10 day IL with left shoulder subluxation / strained left shoulder,10, left shoulder subluxation / strained left shoulder,620439.0,0
2020-09-08, Padres,Eric Hosmer, placed on 10 day IL with fractured index finger on left hand,10, fractured index finger on left hand,543333.0,0
2020-09-08, Royals,Jorge Soler, placed on 10 day IL with strained right oblique muscle,10, strained right oblique muscle,624585.0,0
2020-09-09, Diamondbacks,Ketel Marte, placed on 10 day IL with left wrist inflammation,10, left wrist inflammation,606466.0,0
2020-09-09, Nationals,Howie Kendrick, placed on 10 day IL with strained left hamstring (out for season),10, strained left hamstring (out for season),435062.0,0
2020-09-09, Rangers,Shin-Soo Choo, placed on 10 day IL with sprained right hand,10, sprained right hand,425783.0,0
2020-09-10, Marlins,Jon Berti, placed on 10 day IL with laceration in right index finger,10, laceration in right index finger,542932.0,0
2020-09-10, Rangers,Yadiel Rivera, placed on 10 day IL with undisclosed injury,10, undisclosed injury,592680.0,0
2020-09-11, Twins,Luis Arraez, placed on 10 day IL with left knee tendinitis,10, left knee tendinitis,650333.0,0
2020-09-12, Athletics,Matt Chapman, placed on 10 day IL with strained right hip,10, strained right hip,656305.0,0
2020-09-12, Rangers,Elvis Andrus, placed on 10 day IL with strained lower back,10, strained lower back,462101.0,0
2020-09-13, Rangers,Jose Trevino, placed on 10 day IL with left wrist impingement,10, left wrist impingement,624431.0,0
2020-09-13, Twins,Brent Rooker, placed on 10 day IL with fractured right forearm,10, fractured right forearm,667670.0,0
2020-09-14, Cardinals,Austin Dean, placed on 10 day IL with strained right elbow,10, strained right elbow,621573.0,0
2020-09-15, Marlins,Isan Diaz, placed on 60 day IL with strained left groin,60, strained left groin,656371.0,0
2020-09-15, Phillies,Rhys Hoskins, placed on 10 day IL with strained left elbow,10, strained left elbow,656555.0,0
2020-09-16, Blue Jays,Derek Fisher, placed on 10 day IL with bruised right knee,10, bruised right knee,605233.0,0
2020-09-16, Phillies,Kyle Garlick, placed on 10 day IL with strained right oblique muscle,10, strained right oblique muscle,664247.0,0
2020-09-17, Pirates,Cole Tucker, placed on 7 day IL with concussion,7, concussion,657061.0,0
2020-09-18, Rays,Austin Meadows, placed on 10 day IL with strained left oblique,10, strained left oblique,640457.0,0
2020-09-19, Red Sox,Yairo Munoz, placed on 10 day IL with lower back spasms / strained lower back,10, lower back spasms / strained lower back,622168.0,0
2020-09-20, Brewers,Ben Gamel, placed on 10 day IL with strained left quadriceps,10, strained left quadriceps,592325.0,0
2020-09-20, Pirates,Kevin Newman, placed on 10 day IL with bruised peroneal nerve in left knee,10, bruised peroneal nerve in left knee,621028.0,0
2020-09-21, Mets,Jake Marisnick, placed on 10 day IL with tightness in right hamstring,10, tightness in right hamstring,545350.0,0
2020-09-21, Rockies,Nolan Arenado, placed on 10 day IL with bone bruise in left shoulder,10, bone bruise in left shoulder,571448.0,0
2020-09-22, Giants,Chadwick Tromp, placed on 10 day IL with strained right shoulder,10, strained right shoulder,644433.0,0
2020-09-23, Mariners,Jake Fraley, placed on 10 day IL with strained right quadriceps,10, strained right quadriceps,641584.0,0
2020-09-23, Nationals,Carter Kieboom, placed on 10 day IL with bruised left wrist,10, bruised left wrist,666198.0,0
2020-09-23, Rockies,David Dahl, placed on 60 day IL with strained right shoulder,60, strained right shoulder,621311.0,0
2020-09-23, Royals,Bubba Starling, placed on 10 day IL with lower back spasms,10, lower back spasms,605490.0,0
2020-09-24, Mets,Michael Conforto, placed on 10 day IL with tightness in left hamstring,10, tightness in left hamstring,624424.0,0
2020-09-25, Royals,Jorge Soler, placed on 10 day IL with strained right oblique muscle,10, strained right oblique muscle,624585.0,0
2020-09-25, Tigers,Jeimer Candelario, placed on 10 day IL with strained lower back,10, strained lower back,600869.0,0
2020-09-26, Angels,Luis Rengifo, placed on 10 day IL with strained right hamstring,10, strained right hamstring,650859.0,0
2020-09-26, Mets,Andres Gimenez, placed on 10 day IL with tightness in right oblique muscle,10, tightness in right oblique muscle,665926.0,0
2020-09-27, Rangers,Sherten Apostel, placed on 10 day IL with tightness in lower back,10, tightness in lower back,665947.0,0
2020-09-28, Pirates,Anthony Alford, transferred to 60 day IL placed on 10 day / 60 day IL with fractured right elbow,60, fractured right elbow,546990.0,0
2020-10-13, Braves,Adam Duvall, placed on 10 day / 60 day IL with strained left oblique,60, strained left oblique,594807.0,0
2021-02-22, Red Sox,Franchy Cordero, placed on 10 day IL with COVID 19 positive test,10, COVID 19 positive test,614173.0,0
2021-03-10, Reds,Joey Votto, placed on 10 day IL with COVID 19 positive test,10, COVID 19 positive test,458015.0,0
2021-03-16, Brewers,Mark Mathias, placed on 60 day IL with surgery on right shoulder to repair torn labrum,60, surgery on right shoulder to repair torn labrum,664029.0,0
2021-03-31, Angels,Franklin Barreto, placed on 60 day IL with strained right elbow,60, strained right elbow,620439.0,0
2021-03-31, Mariners,Kyle Lewis, placed on 10 day IL with bone bruise in right knee,10, bone bruise in right knee,641786.0,0
2021-03-31, Yankees,Luke Voit, placed on 10 day IL with torn medial meniscus in left knee,10, torn medial meniscus in left knee,572228.0,0
2021-03-31, Yankees,Miguel Andujar, placed on 10 day IL with carpal tunnel syndrome in right wrist,10, carpal tunnel syndrome in right wrist,609280.0,0
2021-04-01, Blue Jays,George Springer, placed on 10 day IL with strained left oblique,10, strained left oblique,543807.0,0
2021-04-01, Brewers,Derek Fisher, placed on 10 day IL with strained left hamstring,10, strained left hamstring,605233.0,0
2021-04-01, Brewers,Jacob Nottingham, placed on 10 day IL with sprained left thumb,10, sprained left thumb,641924.0,0
2021-04-01, Cardinals,Harrison Bader, placed on 10 day IL with strained right forearm,10, strained right forearm,664056.0,0
2021-04-01, Diamondbacks,Kole Calhoun, placed on 10 day IL with torn medial meniscus in right knee,10, torn medial meniscus in right knee,594777.0,0
2021-04-01, Marlins,Jesus Sanchez, placed on 10 day IL with right groin injury,10, right groin injury,660821.0,0
2021-04-01, Padres,Austin Nola, placed on 10 day IL with fractured left middle finger,10, fractured left middle finger,543592.0,0
2021-04-01, Padres,Jorge Ona, placed on 10 day IL with right elbow inflammation,10, right elbow inflammation,671250.0,0
2021-04-01, Rangers,Khris Davis, placed on 10 day IL with strained left quadriceps,10, strained left quadriceps,501981.0,0
2021-04-01, Rangers,Sam Huff, placed on 10 day IL with strained left hamstring,10, strained left hamstring,669087.0,0
2021-04-01, Rangers,Willie Calhoun, placed on 10 day IL with strained left groin,10, strained left groin,641432.0,0
2021-04-01, Reds,Shogo Akiyama, placed on 10 day IL with strained left hamstring,10, strained left hamstring,673451.0,0
2021-04-01, Rockies,Brendan Rodgers, placed on 10 day IL with strained right hamstring,10, strained right hamstring,663898.0,0
2021-04-01, White Sox,Adam Engel, placed on 10 day IL with strained right hamstring,10, strained right hamstring,641553.0,0
2021-04-01, White Sox,Eloy Jimenez, placed on 60 day IL recovering from surgery to repaor torn left pectoral tendon,60,unknown,650391.0,0
2021-04-03, Diamondbacks,Nick Ahmed, placed on 10 day IL with right knee inflammation,10, right knee inflammation,605113.0,0
2021-04-04, Pirates,Ke'Bryan Hayes, placed on 10 day IL with jammed left wrist,10, jammed left wrist,663647.0,0
2021-04-05, Marlins,Garrett Cooper, placed on 10 day IL with COVID 19 (adverse reaction),10, COVID 19 (adverse reaction),643265.0,0
2021-04-05, Orioles,Austin Hays, placed on 10 day IL with strained right hamstring,10, strained right hamstring,669720.0,0
2021-04-06, Nationals,Jordy Mercer, placed on 10 day IL with COVID 19 exposure,10, COVID 19 exposure,474568.0,0
2021-04-06, Nationals,Kyle Schwarber, placed on 10 day IL with COVID 19 positive test,10, COVID 19 positive test,656941.0,0
2021-04-06, Nationals,Yan Gomes, placed on 10 day IL with COVID 19 exposure,10, COVID 19 exposure,543228.0,0
2021-04-06, Padres,Fernando Tatis Jr., placed on 10 day IL with left shoulder subluxation / inflammation,10, left shoulder subluxation / inflammation,665487.0,0
2021-04-06, Rays,Kevin Kiermaier, placed on 10 day IL with strained left quadriceps,10, strained left quadriceps,595281.0,0
2021-04-07, Mariners,Jake Fraley, placed on 10 day IL with strained left hamstring,10, strained left hamstring,641584.0,0
2021-04-07, Twins,Brent Rooker, placed on 10 day IL with cervical sprain/strain,10, cervical sprain/strain,667670.0,0
2021-04-08, Diamondbacks,Ketel Marte, placed on 10 day IL with strained right hamstring,10, strained right hamstring,606466.0,0
2021-04-08, White Sox,Billy Hamilton (R.), placed on 10 day IL with strained left hamstring,10, strained left hamstring,571740.0,0
2021-04-08, Yankees,Rougned Odor, placed on 10 day IL with COVID 19 intake testing,10, COVID 19 intake testing,596059.0,0
2021-04-09, Blue Jays,Teoscar Hernandez, placed on 10 day IL with COVID 19 positive test,10, COVID 19 positive test,606192.0,0
2021-04-09, Dodgers,Cody Bellinger, placed on 10 day IL with bruised left calf / fractured fibula in left leg,10, bruised left calf / fractured fibula in left leg,641355.0,0
2021-04-10, Angels,Dexter Fowler, placed on 10 day IL with torn ACL in left knee,10, torn ACL in left knee,451594.0,0
2021-04-10, Blue Jays,Lourdes Gurriel Jr., placed on 10 day IL with COVID 19 adverse reaction,10, COVID 19 adverse reaction,666971.0,0
2021-04-10, Brewers,Kolten Wong, placed on 10 day IL with strained left oblique,10, strained left oblique,543939.0,0
2021-04-11, Cardinals,Tyler O'Neill, placed on 10 day IL with strained right groin,10, strained right groin,641933.0,0
2021-04-11, Giants,Jaylin Davis, placed on 60 day IL with patella tendinitis in left knee,60, patella tendinitis in left knee,664041.0,0
2021-04-12, Angels,Anthony Rendon, placed on 10 day IL with strained left groin,10, strained left groin,543685.0,0
2021-04-12, Diamondbacks,Christian Walker, placed on 10 day IL with strained right oblique muscle,10, strained right oblique muscle,572233.0,0
2021-04-13, Angels,Juan Lagares, placed on 10 day IL with strained left calf,10, strained left calf,501571.0,0
2021-04-13, Rangers,Ronald Guzman, placed on 10 day IL with torn meniscus in right knee,10, torn meniscus in right knee,608597.0,0
2021-04-14, Astros,Alex Bregman, placed on 10 day IL with COVID 19 exposure,10, COVID 19 exposure,608324.0,0
2021-04-14, Astros,Jose Altuve," placed on 10 day IL with COVID 19 exposure, positive test",10," COVID 19 exposure, positive test",514888.0,0
2021-04-14, Astros,Yordan Alvarez, placed on 10 day IL with COVID 19 exposure,10, COVID 19 exposure,670541.0,0
2021-04-14, Braves,Cristian Pache, placed on 10 day IL with straiined left groin,10, straiined left groin,665506.0,0
2021-04-14, Brewers,Lorenzo Cain, placed on 10 day IL with strained left quadriceps,10, strained left quadriceps,456715.0,0
2021-04-15, Tigers,Nomar Mazara, placed on 10 day IL with strained left abdominal muscle,10, strained left abdominal muscle,608577.0,0
2021-04-16, Reds,Aristides Aquino, placed on 10 day IL with fractured hamate bone in left wrist,10, fractured hamate bone in left wrist,606157.0,0
2021-04-17, Braves,Ender Inciarte, placed on 10 day IL with strained left hamstring,10, strained left hamstring,542255.0,0
2021-04-17, Brewers,Christian Yelich, placed on 10 day IL with strained lower back / tightness in lower back,10, strained lower back / tightness in lower back,592885.0,0
2021-04-18, Diamondbacks,Tim Locastro, placed on 10 day IL with dislocated left pinkie finger,10, dislocated left pinkie finger,641796.0,0
2021-04-18, Dodgers,Gavin Lux, placed on 10 day IL with sore right wrist,10, sore right wrist,666158.0,0
2021-04-20, Astros,Taylor Jones, placed on 10 day IL with COVID 19 protocol for exposure,10, COVID 19 protocol for exposure,622100.0,0
2021-04-20, Marlins,Starling Marte, placed on 10 day IL with non displaced fracture in left rib,10, non displaced fracture in left rib,516782.0,0
2021-04-20, Reds,Mike Moustakas, placed on 10 day IL with illness,10, illness,519058.0,0
2021-04-20, Twins,Kyle Garlick, placed on 10 day IL with COVID 19 positive test,10, COVID 19 positive test,664247.0,0
2021-04-20, Twins,Max Kepler, placed on 10 day IL with COVID 19 positive test,10, COVID 19 positive test,596146.0,0
2021-04-20, Twins,Travis Blankenhorn, placed on COVID 19 IL,0,unknown,663905.0,0
2021-04-21, Marlins,Jorge Alfaro, placed on 10 day IL with strained left hamstring,10, strained left hamstring,595751.0,0
2021-04-21, Orioles,Anthony Santander, placed on 10 day IL with sprained left ankle,10, sprained left ankle,623993.0,0
2021-04-21, Phillies,Jean Segura, placed on 10 day IL with strained right quadriceps,10, strained right quadriceps,516416.0,0
2021-04-21, Twins,J.T. Riddle, placed on 10 day IL with COVID 19 exposure,10, COVID 19 exposure,595375.0,0
2021-04-22, Cubs,Joc Pederson, placed on 10 day IL with left wrist tendinitis,10, left wrist tendinitis,592626.0,0
2021-04-22, Giants,Donovan Solano, placed on 10 day IL with strained right calf,10, strained right calf,456781.0,0
2021-04-23, Twins,Miguel Sano, placed on 10 day IL with strained right hamstring,10, strained right hamstring,593934.0,0
2021-04-27, White Sox,Luis Robert Jr., placed on 10 day IL with COVID 19 symptoms,10, COVID 19 symptoms,673357.0,0
2021-04-28, Astros,Yordan Alvarez, placed on 10 day IL with undisclosed / COVID 19,10, undisclosed / COVID 19,670541.0,0
2021-04-28, Diamondbacks,Kole Calhoun, placed on 10 day IL with strained left hamstring,10, strained left hamstring,594777.0,0
2021-04-28, Marlins,Jazz Chisholm Jr., placed on 10 day IL with strained left hamstring,10, strained left hamstring,665862.0,0
2021-04-30, Reds,Jonathan India, placed on 10 day IL with undisclosed injury,10, undisclosed injury,663697.0,0
2021-05-01, Braves,Guillermo Heredia, placed on 10 day IL with right hamstring inflammation / right knee inflammation,10, right hamstring inflammation / right knee inflammation,628338.0,0
2021-05-01, Brewers,Omar Narvaez, placed on 10 day IL with strained left hamstring,10, strained left hamstring,553882.0,0
2021-05-02, Blue Jays,Alejandro Kirk, placed on 10 day IL with strained left hip flexor,10, strained left hip flexor,672386.0,0
